{
  "schemaVersion": "nus.question-templates.v1",
  "courseId": "DSA5101",
  "purpose": "Canonical exam-question archetypes, study cards, and seeded calculation contracts for DSA5101.",
  "archetypes": [
    { "id": "T1-execute", "label": "Execute", "description": "Run the algorithm or formula by hand on a small instance." },
    { "id": "T2-infer", "label": "Infer", "description": "Infer a guaranteed property, boundary, or failure from the invariant." },
    { "id": "T3-tune", "label": "Tune", "description": "Predict how a parameter changes error, precision, recall, or runtime." },
    { "id": "T4-choose", "label": "Choose", "description": "Choose a method and justify it from scale, representation, and objective." }
  ],
  "cards": [
    { "id": "scale-and-passes", "lessonId": "dsa5101-orientation", "title": "Scale: passes, memory, and approximation", "objective": "Compare algorithms using passes, working memory, and the error contract.", "anchor": "nus-study-card-scale-and-passes", "lectureRefs": [{ "sourceId": "DSA5101/DSA5101 Course Information.pdf", "sourceType": "lecture", "page": 1, "role": "scale framing", "status": "current" }] },
    { "id": "assessment-format", "lessonId": "dsa5101-orientation", "title": "Assessment format and weights", "objective": "Identify the official assessment weights and separate course evidence from study priority.", "anchor": "nus-study-card-assessment-format", "lectureRefs": [{ "sourceId": "DSA5101/DSA5101 Course Information.pdf", "sourceType": "lecture", "page": 2, "role": "assessment weights", "status": "current" }] },
    { "id": "support-confidence-lift", "lessonId": "dsa5101-frequent-itemsets", "title": "Support, confidence, and lift denominators", "objective": "Keep basket support, conditional confidence, and baseline lift separate.", "anchor": "nus-study-card-support-confidence-lift", "lectureRefs": [{ "sourceId": "DSA5101/Lec1 - Assoc Rules, Frequent itemsets.pdf", "sourceType": "lecture", "page": 28, "role": "association-rule metrics", "status": "current" }] },
    { "id": "apriori-monotonicity", "lessonId": "dsa5101-frequent-itemsets", "title": "Apriori: subset, superset, and downward closure", "objective": "Use an infrequent itemset to prune every superset, never a subset.", "anchor": "nus-study-card-apriori-monotonicity", "lectureRefs": [{ "sourceId": "DSA5101/Lec1 - Assoc Rules, Frequent itemsets.pdf", "sourceType": "lecture", "page": 36, "role": "downward closure", "status": "current" }] },
    { "id": "apriori-candidate-generation", "lessonId": "dsa5101-frequent-itemsets", "title": "Apriori: generate $C_k$ and prune to $L_k$", "objective": "Join only compatible frequent $(k-1)$-itemsets, then remove candidates with an infrequent subset.", "anchor": "nus-study-card-apriori-candidate-generation", "lectureRefs": [{ "sourceId": "DSA5101/Lec1 - Assoc Rules, Frequent itemsets.pdf", "sourceType": "lecture", "page": 36, "role": "Apriori candidate pruning", "status": "current" }] },
    { "id": "pcy-two-pass", "lessonId": "dsa5101-frequent-itemsets", "title": "PCY: bucket counts across two passes", "objective": "Separate frequent items from frequent hash buckets before counting candidate pairs.", "anchor": "nus-study-card-pcy-two-pass", "lectureRefs": [{ "sourceId": "DSA5101/Lec1 - Assoc Rules, Frequent itemsets.pdf", "sourceType": "lecture", "page": 54, "role": "PCY passes", "status": "current" }] },
    { "id": "shingle-jaccard", "lessonId": "dsa5101-minhash-lsh", "title": "Shingles as sets and Jaccard similarity", "objective": "Deduplicate shingles within each document before computing set Jaccard.", "anchor": "nus-study-card-shingle-jaccard", "lectureRefs": [{ "sourceId": "DSA5101/Lec 2 - Finding Similar items, LSH.pdf", "sourceType": "lecture", "page": 8, "role": "shingling and Jaccard", "status": "current" }] },
    { "id": "minhash-signature", "lessonId": "dsa5101-minhash-lsh", "title": "Characteristic matrix to MinHash signature", "objective": "Evaluate the minimum permuted row for each hash function and column.", "anchor": "nus-study-card-minhash-signature", "lectureRefs": [{ "sourceId": "DSA5101/Lec 2 - Finding Similar items, LSH.pdf", "sourceType": "lecture", "page": 37, "role": "MinHash signature", "status": "current" }] },
    { "id": "minhash-collision", "lessonId": "dsa5101-minhash-lsh", "title": "MinHash collision versus Jaccard", "objective": "Use one-row collision probability $s$ and do not confuse it with a whole signature or LSH candidate event.", "anchor": "nus-study-card-minhash-collision", "lectureRefs": [{ "sourceId": "DSA5101/Lec 2 - Finding Similar items, LSH.pdf", "sourceType": "lecture", "page": 43, "role": "MinHash collision", "status": "current" }] },
    { "id": "lsh-probability", "lessonId": "dsa5101-minhash-lsh", "title": "LSH: row, band, and whole-signature probabilities", "objective": "Compute $s^r$ for one band and $1-(1-s^r)^b$ for at least one matching band.", "anchor": "nus-study-card-lsh-probability", "lectureRefs": [{ "sourceId": "DSA5101/Lec 2 - Finding Similar items, LSH.pdf", "sourceType": "lecture", "page": 62, "role": "LSH banding probability", "status": "current" }] },
    { "id": "lsh-tuning", "lessonId": "dsa5101-minhash-lsh", "title": "LSH tuning: bands, rows, precision, and recall", "objective": "Recognize that more bands make the OR candidate event easier and usually raise recall while admitting more false positives.", "anchor": "nus-study-card-lsh-tuning", "lectureRefs": [{ "sourceId": "DSA5101/Lec 2 - Finding Similar items, LSH.pdf", "sourceType": "lecture", "page": 70, "role": "LSH parameter trade-off", "status": "current" }] },
    { "id": "lsh-candidate-verification", "lessonId": "dsa5101-minhash-lsh", "title": "LSH candidate verification", "objective": "Treat a band collision as a candidate signal and verify exact Jaccard before claiming similarity.", "anchor": "nus-study-card-lsh-candidate-verification", "lectureRefs": [{ "sourceId": "DSA5101/Lec 2 - Finding Similar items, LSH.pdf", "sourceType": "lecture", "page": 82, "role": "candidate verification", "status": "current" }] },
    { "id": "hierarchical-linkage", "lessonId": "dsa5101-clustering", "title": "Hierarchical clustering: single, complete, and average linkage", "objective": "Recompute the distance between clusters using the stated linkage, not a remembered default.", "anchor": "nus-study-card-hierarchical-linkage", "lectureRefs": [{ "sourceId": "DSA5101/Lec3 - Clustering.pdf", "sourceType": "lecture", "page": 21, "role": "hierarchical linkage", "status": "current" }] },
    { "id": "kmeans-update", "lessonId": "dsa5101-clustering", "title": "K-means assignment and centroid update", "objective": "Alternate nearest-centroid assignment with the mean update while tracking the squared-error objective.", "anchor": "nus-study-card-kmeans-update", "lectureRefs": [{ "sourceId": "DSA5101/Lec3 - Clustering.pdf", "sourceType": "lecture", "page": 37, "role": "K-means objective", "status": "current" }] },
    { "id": "bfr-cure-summaries", "lessonId": "dsa5101-clustering", "title": "BFR and CURE summaries", "objective": "Classify discard, compression, retained, and representative-point states by what information they preserve.", "anchor": "nus-study-card-bfr-cure-summaries", "lectureRefs": [{ "sourceId": "DSA5101/Lec3 - Clustering.pdf", "sourceType": "lecture", "page": 62, "role": "BFR and CURE summaries", "status": "current" }] },
    { "id": "clustering-evaluation", "lessonId": "dsa5101-clustering", "title": "Clustering evaluation and purity limits", "objective": "Interpret purity with cluster count and distinguish external-label scores from intrinsic utility.", "anchor": "nus-study-card-clustering-evaluation", "lectureRefs": [{ "sourceId": "DSA5101/Lec3 - Clustering.pdf", "sourceType": "lecture", "page": 86, "role": "purity and evaluation", "status": "current" }] },
    { "id": "recommender-centering", "lessonId": "dsa5101-recommenders", "title": "User-based recommendation: center ratings before cosine", "objective": "Subtract each user mean on the shared items before comparing rating direction.", "anchor": "nus-study-card-recommender-centering", "lectureRefs": [] },
    { "id": "recommender-prediction", "lessonId": "dsa5101-recommenders", "title": "Neighbour overlap and weighted prediction", "objective": "Use only shared rated items and keep the similarity weighting denominator explicit.", "anchor": "nus-study-card-recommender-prediction", "lectureRefs": [] },
    { "id": "recommender-latent-factors", "lessonId": "dsa5101-recommenders", "title": "Latent-factor prediction", "objective": "Distinguish a dot-product prediction from a neighbourhood estimate.", "anchor": "nus-study-card-recommender-latent-factors", "lectureRefs": [] },
    { "id": "pagerank-transition", "lessonId": "dsa5101-pagerank", "title": "PageRank transition orientation and power iteration", "objective": "Fix row- versus column-stochastic convention before multiplying the rank vector.", "anchor": "nus-study-card-pagerank-transition", "lectureRefs": [] },
    { "id": "pagerank-teleport-dangling", "lessonId": "dsa5101-pagerank", "title": "PageRank teleportation and dangling nodes", "objective": "Redistribute teleport or leaked mass using the convention stated in the problem.", "anchor": "nus-study-card-pagerank-teleport-dangling", "lectureRefs": [] },
    { "id": "dgim-window", "lessonId": "dsa5101-streams", "title": "DGIM: recent-window query and oldest bucket", "objective": "Use the oldest partially covered bucket for the boundary estimate and expose its error bound.", "anchor": "nus-study-card-dgim-window", "lectureRefs": [] },
    { "id": "stream-moments", "lessonId": "dsa5101-streams", "title": "Flajolet–Martin versus AMS moments", "objective": "Match distinct-count sketches to $F_0$ and frequency-moment sketches to $F_k$.", "anchor": "nus-study-card-stream-moments", "lectureRefs": [] },